title,description,body,img_url,thumbnail,status,updated,provenance,content_items,recipe_id,authors,id,created,url,tag_ids,meta,source_idTweet from Erica Kiro,What a wonderful @newslynx article. Must read,What a wonderful @newslynx article. Must read,http://example.com/d25cc021-0c98-11e5-b0a9-6c4008aeb606.png,"data:image/png;base64,iVBORw0KGgoAAAANSUhEUgAAABQAAAAeCAYAAAAsEj5rAAAAU0lEQVR42u3VOwoAMAgE0dwfAnNjU26bYkBCFGwfiL9VVWoO+BJ4Gf3gtsEKKoFBNTCoCAYVwaAiGNQGMUHMkjGbgjk2mIONuXo0nC8XnCf1JXgArVIZAQh5TKYAAAAASUVORK5CYII=",pending,2015-06-06T22:10:22.137437+00:00,recipe,RANDOM,RANDOM,"[""Merlynne Jones""]",RANDOM,RANDOM,http://example.com/d25cbf6b-0c98-11e5-9e0f-6c4008aeb606,RANDOM,RANDOM,TWITTER USERTweet from Rep Washington,Congress must act on Lynx endangerment! Read this report.,Congress must act on Lynx endangerment! Read this report.,http://example.com/d25cc021-0c98-11e5-b0a9-6c4008aeb606.png,"data:image/png;base64,iVBORw0KGgoAAAANSUhEUgAAABQAAAAeCAYAAAAsEj5rAAAAU0lEQVR42u3VOwoAMAgE0dwfAnNjU26bYkBCFGwfiL9VVWoO+BJ4Gf3gtsEKKoFBNTCoCAYVwaAiGNQGMUHMkjGbgjk2mIONuXo0nC8XnCf1JXgArVIZAQh5TKYAAAAASUVORK5CYII=",pending,2015-06-06T22:10:22.137437+00:01,recipe,RANDOM,RANDOM,"[""Merlynne Jones""]",RANDOM,RANDOM,http://example.com/d25cbf6b-0c98-11e5-9e0f-6c4008aeb607,RANDOM,RANDOM,TWITTER LISTLongreads: How the US is failing the Lynx,"Ten years ago the Lynx were prosperous, now few remain","On a snowy night, Merlynne shows me her latest prey — a snowshoe hare — one of the few that remain in these parts.",http://example.com/d25cc021-0c98-11e5-b0a9-6c4008aeb606.png,"data:image/png;base64,iVBORw0KGgoAAAANSUhEUgAAABQAAAAeCAYAAAAsEj5rAAAAU0lEQVR42u3VOwoAMAgE0dwfAnNjU26bYkBCFGwfiL9VVWoO+BJ4Gf3gtsEKKoFBNTCoCAYVwaAiGNQGMUHMkjGbgjk2mIONuXo0nC8XnCf1JXgArVIZAQh5TKYAAAAASUVORK5CYII=",pending,2015-06-06T22:10:22.137437+00:02,recipe,RANDOM,RANDOM,"[""Merlynne Jones""]",RANDOM,RANDOM,http://example.com/d25cbf6b-0c98-11e5-9e0f-6c4008aeb608,RANDOM,RANDOM,GOOGLE ALERTSCOTUS: LynxReads report showed clear and present danger to the population.,US Supreme Court decides in favor of Lynx protection.,The Lynx has shown to be an important and vital animal in our ecosystem. We must not allow them to leave us.,http://example.com/d25cc021-0c98-11e5-b0a9-6c4008aeb606.png,"data:image/png;base64,iVBORw0KGgoAAAANSUhEUgAAABQAAAAeCAYAAAAsEj5rAAAAU0lEQVR42u3VOwoAMAgE0dwfAnNjU26bYkBCFGwfiL9VVWoO+BJ4Gf3gtsEKKoFBNTCoCAYVwaAiGNQGMUHMkjGbgjk2mIONuXo0nC8XnCf1JXgArVIZAQh5TKYAAAAASUVORK5CYII=",pending,2015-06-06T22:10:22.137437+00:03,recipe,RANDOM,RANDOM,"[""Merlynne Jones""]",RANDOM,RANDOM,http://example.com/d25cbf6b-0c98-11e5-9e0f-6c4008aeb609,RANDOM,RANDOM,GOOGLE ALERTLynx reform: Is it worth it?,Congress wants to spend millions to protect Lynx. Can we afford that?,Rabbit-fan233: I say let the Lynx starve!,http://example.com/d25cc021-0c98-11e5-b0a9-6c4008aeb606.png,"data:image/png;base64,iVBORw0KGgoAAAANSUhEUgAAABQAAAAeCAYAAAAsEj5rAAAAU0lEQVR42u3VOwoAMAgE0dwfAnNjU26bYkBCFGwfiL9VVWoO+BJ4Gf3gtsEKKoFBNTCoCAYVwaAiGNQGMUHMkjGbgjk2mIONuXo0nC8XnCf1JXgArVIZAQh5TKYAAAAASUVORK5CYII=",pending,2015-06-06T22:10:22.137437+00:04,recipe,RANDOM,RANDOM,"[""Merlynne Jones""]",RANDOM,RANDOM,http://example.com/d25cbf6b-0c98-11e5-9e0f-6c4008aeb610,RANDOM,RANDOM,REDDIT SEARCHTweet from Jacqueline Ellamore,This changed my mind forever on Lynx reform. Bit.ly/lynx-reads,This changed my mind forever on Lynx reform. Bit.ly/lynx-reads,http://example.com/d25cc021-0c98-11e5-b0a9-6c4008aeb606.png,"data:image/png;base64,iVBORw0KGgoAAAANSUhEUgAAABQAAAAeCAYAAAAsEj5rAAAAU0lEQVR42u3VOwoAMAgE0dwfAnNjU26bYkBCFGwfiL9VVWoO+BJ4Gf3gtsEKKoFBNTCoCAYVwaAiGNQGMUHMkjGbgjk2mIONuXo0nC8XnCf1JXgArVIZAQh5TKYAAAAASUVORK5CYII=",pending,2015-06-06T22:10:22.137437+00:05,recipe,RANDOM,RANDOM,"[""Merlynne Jones""]",RANDOM,RANDOM,http://example.com/d25cbf6b-0c98-11e5-9e0f-6c4008aeb611,RANDOM,RANDOM,TWITTER SEARCHMarch to save the Lynx!,Sign up to join us this Sunday! More info: bit.ly/lynx-reads,We're marching because we want to make a different for all Lynx.,http://example.com/d25cc021-0c98-11e5-b0a9-6c4008aeb606.png,"data:image/png;base64,iVBORw0KGgoAAAANSUhEUgAAABQAAAAeCAYAAAAsEj5rAAAAU0lEQVR42u3VOwoAMAgE0dwfAnNjU26bYkBCFGwfiL9VVWoO+BJ4Gf3gtsEKKoFBNTCoCAYVwaAiGNQGMUHMkjGbgjk2mIONuXo0nC8XnCf1JXgArVIZAQh5TKYAAAAASUVORK5CYII=",pending,2015-06-06T22:10:22.137437+00:06,recipe,RANDOM,RANDOM,"[""Merlynne Jones""]",RANDOM,RANDOM,http://example.com/d25cbf6b-0c98-11e5-9e0f-6c4008aeb612,RANDOM,RANDOM,FACEBOOK PAGELynx podcast: Hear our reporters discuss their findings,Merlynne Jones spent nine months investigating the Lynx. Hear how she did it.,It all started when I was young…,http://example.com/d25cc021-0c98-11e5-b0a9-6c4008aeb606.png,"data:image/png;base64,iVBORw0KGgoAAAANSUhEUgAAABQAAAAeCAYAAAAsEj5rAAAAU0lEQVR42u3VOwoAMAgE0dwfAnNjU26bYkBCFGwfiL9VVWoO+BJ4Gf3gtsEKKoFBNTCoCAYVwaAiGNQGMUHMkjGbgjk2mIONuXo0nC8XnCf1JXgArVIZAQh5TKYAAAAASUVORK5CYII=",pending,2015-06-06T22:10:22.137437+00:07,recipe,RANDOM,RANDOM,"[""Merlynne Jones""]",RANDOM,RANDOM,http://example.com/d25cbf6b-0c98-11e5-9e0f-6c4008aeb613,RANDOM,RANDOM,MANUALLynxReads wins best news site award!,The Feline winners were announced today — the most prestigious award in cat-based reporting.,The Feline winners were announced today — the most prestigious award in cat-based reporting.,http://example.com/d25cc021-0c98-11e5-b0a9-6c4008aeb606.png,"data:image/png;base64,iVBORw0KGgoAAAANSUhEUgAAABQAAAAeCAYAAAAsEj5rAAAAU0lEQVR42u3VOwoAMAgE0dwfAnNjU26bYkBCFGwfiL9VVWoO+BJ4Gf3gtsEKKoFBNTCoCAYVwaAiGNQGMUHMkjGbgjk2mIONuXo0nC8XnCf1JXgArVIZAQh5TKYAAAAASUVORK5CYII=",pending,2015-06-06T22:10:22.137437+00:08,recipe,RANDOM,RANDOM,"[""Merlynne Jones""]",RANDOM,RANDOM,http://example.com/d25cbf6b-0c98-11e5-9e0f-6c4008aeb614,RANDOM,RANDOM,MANUAL